source,LoanNumber,BorrowerName,BorrowerAddress,BorrowerCity,BorrowerState,county,amount,status,date,lender,orig_lender,NAICSCode,ein
OSINT,NA,ST. BARBARA GREEK ORTHODOX CHURCH INC.,480 Racebrook Rd,Orange,CT,ORANGE,0.0,nonprofit,NA,NA,NA,,
OSINT,NA,ST BARBARA GREEK ORTHODOX CHURCH INC,480 RACEBROOK RD,ORANGE,CT,ORANGE,0.0,nonprofit,NA,NA,NA,,
OSINT,NA,OUR LADY OF MERCY CHURCH,5201 MILITARY TRL,POMPANO BEACH,FL,ORANGE,0.0,church,NA,NA,NA,,
OSINT,NA,DIVINE MERCY CATHOLIC CHURCH,1940 N COURTENAY PKWY,MERRITT ISLAND,FL,ORANGE,0.0,nonprofit,NA,NA,NA,,
OSINT,NA,"MERCY FELLOWSHIP OF VENICE, FL, INC",1200 Ogden Rd,Venice,FL,ORANGE,0.0,nonprofit,NA,NA,NA,,
OSINT,NA,DIVINE MERCY CATHOLIC ACADEMY,1940 N COURTENAY PKWY,MERRITT ISLAND,FL,ORANGE,0.0,nonprofit,NA,NA,NA,,
OSINT,NA,HEART OF MERCY COMMUNITY CHURCH,1531 Mercy Dr N/A,Orlando,FL,ORANGE,0.0,nonprofit,NA,NA,NA,,
OSINT,NA,"NEW MERCY BAPTIST CHURCH, INC.",742 Park Road,Griffin,GA,ORANGE,0.0,church,NA,NA,NA,,
OSINT,NA,OUR LADY OF MERCY CATHOLIC HIGH SCHOOL,861 Highway 279,Fayetteville,GA,ORANGE,0.0,nonprofit,NA,NA,NA,,
OSINT,NA,MERCY HILL CHURCH INC,3189 HARTNESS WAY,KENNESAW,GA,ORANGE,0.0,nonprofit,NA,NA,NA,,
OSINT,NA,MERCY RIDGE CHURCH,432 MACK SMITH RD,ROSSVILLE,GA,ORANGE,0.0,nonprofit,NA,NA,NA,,
OSINT,NA,OUR LADY OF MERCY CATHOLIC HIGH SCHOOL,861 Highway 279,Fayetteville,GA,ORANGE,0.0,nonprofit,NA,NA,NA,,
OSINT,NA,MERCY SEAT ASSEMBLY C.O.G.W,2265 Roswell Rd Ste 100,Marietta,GA,ORANGE,0.0,nonprofit,NA,NA,NA,,
OSINT,NA,GRACE & MERCY CHURCH OF GOD IN CHRIST INC.,15314 Page Ave,Harvey,IL,ORANGE,0.0,church,NA,NA,NA,,
OSINT,NA,DIVINE MERCY PARISH CATHOLIC BISHOP OF CHICAGO,1077 TOWER ROAD,WINNETKA,IL,ORANGE,0.0,nonprofit,NA,NA,NA,,
OSINT,NA,OUR LADY OF MERCY CHURCH/CATHOLIC BISHOP OF CHICAGO,4432 N. Troy Street,CHICAGO,IL,ORANGE,0.0,nonprofit,NA,NA,NA,,
OSINT,NA,DIVINE MERCY PARISH CATHOLIC BISHOP OF CHICAGO,1077 Tower Rd,Winnetka,IL,ORANGE,0.0,nonprofit,NA,NA,NA,,
OSINT,NA,MERCY'S DOOR COMMUNITY CHURCH,227 E Main St,Mascoutah,IL,ORANGE,0.0,nonprofit,NA,NA,NA,,
OSINT,NA,MERCY VINEYARD CHURCH,1801 10th Street,MOLINE,IL,ORANGE,0.0,nonprofit,NA,NA,NA,,
OSINT,NA,OUR LADY OF MERCY CHURCH/CATHOLIC BISHOP OF CHICAGO,4432 N Troy St,Chicago,IL,ORANGE,0.0,nonprofit,NA,NA,NA,,
OSINT,NA,MERCY'S DOOR COMMUNITY CHURCH,"227 E Main ST,",Mascoutah,IL,ORANGE,0.0,nonprofit,NA,NA,NA,,
OSINT,NA,OUR LADY OF MERCY CHURCH,801 S EOLA RD,AURORA,IL,ORANGE,0.0,nonprofit,NA,NA,NA,,
OSINT,NA,MERCY ROAD CHURCH,2381 Pointe Parkway,CARMEL,IN,ORANGE,0.0,nonprofit,NA,NA,NA,,
OSINT,NA,OUR LADY OF MERCY CATHOLIC SCHOOL,400 MARQUETTE AVE,BATON ROUGE,LA,ORANGE,0.0,nonprofit,NA,NA,NA,,
OSINT,NA,DIVINE MERCY ROMAN CATHOLIC CHURCH,4337 Sal Lentini Pkwy,KENNER,LA,ORANGE,0.0,nonprofit,NA,NA,NA,,
OSINT,NA,CONGREGATION OF OUR LADY OF MERCY ROMAN CATHOLIC CHURCH,445 Marquette Avenue,BATON ROUGE,LA,ORANGE,0.0,nonprofit,NA,NA,NA,,
OSINT,NA,"CARROLL LUTHERAN VILLAGE, INC.",300 St. Luke Circle,WESTMINSTER,MD,ORANGE,0.0,church,NA,NA,NA,,
OSINT,NA,"LUTHERAN SOCIAL MINISTRIES OF MARYLAND, INC.",300 St. Luke Circle,WESTMINSTER,MD,ORANGE,0.0,church,NA,NA,NA,,
OSINT,NA,OUR LADY OF MERCY CHURCH AND SCHOOL,9200 KENTSDALE DR,POTOMAC,MD,ORANGE,0.0,nonprofit,NA,NA,NA,,
OSINT,NA,ST. JOHN WESTMINSTER CATHOLIC SCHOOL,45 Monroe Street,Westminster,MD,ORANGE,0.0,nonprofit,NA,NA,NA,,
OSINT,NA,CROSSROADS COMMUNITY CHURCH OF CC,895 Leidy Road,WESTMINSTER,MD,ORANGE,0.0,nonprofit,NA,NA,NA,,
OSINT,NA,"ST JOHN'S, WESTMINSTER, ROMAN CATHOLIC CONGREGATION, INC.",43 Monroe Street,WESTMINSTER,MD,ORANGE,0.0,nonprofit,NA,NA,NA,,
OSINT,NA,CHURCH OF THE OPEN DOOR,550 BALTIMORE BLVD,WESTMINSTER,MD,ORANGE,0.0,nonprofit,NA,NA,NA,,
OSINT,NA,THE CATHOLIC CHURCH OF DIVINE MERCY OF FARIBAULT,4 2nd Avenue SW,FARIBAULT,MN,ORANGE,0.0,nonprofit,NA,NA,NA,,
OSINT,NA,THE CATHOLIC CHURCH OF DIVINE MERCY OF FARIBAULT,15 3rd Ave SW,Faribault,MN,ORANGE,0.0,nonprofit,NA,NA,NA,,
OSINT,NA,OUR LADY OF MERCY CATHOLIC SCHOOL,1730 LINK RD,WINSTON SALEM,NC,ORANGE,0.0,nonprofit,NA,NA,NA,,
OSINT,NA,MERCY HILL CHURCH,7616 BUSINESS PARK DRIVE,GREENSBORO,NC,ORANGE,0.0,nonprofit,NA,NA,NA,,
OSINT,NA,THE CHURCH OF MOTHER OF MERCY ASBURY PARK N.J.,1212 1st Ave,Asbury Park,NJ,ORANGE,0.0,church,NA,NA,NA,,
OSINT,NA,"THE CHURCH OF MOTHER OF MERCY, ASBURY DBA MT CALVARY CEMETER",1212 1ST AVE,Asbury Park,NJ,ORANGE,0.0,church,NA,NA,NA,,
OSINT,NA,OUR LADY OF MERCY CATHOLIC ACADEMY,7025 Kessel Street,FOREST HILLS,NY,ORANGE,0.0,nonprofit,NA,NA,NA,,
OSINT,NA,DIVINE MERCY CATHOLIC ACADEMY,10160 92nd St,Ozone Park,NY,ORANGE,0.0,nonprofit,NA,NA,NA,,
OSINT,NA,OUR LADY OF MERCY CATHOLIC ACADEMY,7025 Kessel St,Forest Hills,NY,ORANGE,0.0,nonprofit,NA,NA,NA,,
OSINT,NA,DIVINE MERCY CATHOLIC ACADEMY-SBA SMALL 7A TERM,101-60 92nd Street,Ozone Park,NY,ORANGE,0.0,nonprofit,NA,NA,NA,,
OSINT,NA,OUR LADY OF MERCY REGIONAL CATHOLIC SCHOOL,29 Conwell Drive,Maple Glen,PA,ORANGE,0.0,nonprofit,NA,NA,NA,,
OSINT,NA,OUR LADY OF MERCY REGIONAL CATHOLIC SCHOOL,29 Conwell Dr,Maple Glen,PA,ORANGE,0.0,nonprofit,NA,NA,NA,,
OSINT,NA,DIVINE MERCY CATHOLIC ACADEMY,2306 BEDFORD ST,JOHNSTOWN,PA,ORANGE,0.0,nonprofit,NA,NA,NA,,
OSINT,NA,FOOTHILLS COMMUNITY CHURCH,505 Bountyland Rd,Westminster,SC,ORANGE,0.0,nonprofit,NA,NA,NA,,
OSINT,NA,COMMUNITY CHURCH ASSEMBLY OF GOD,3400 Martin Luther King Jr Dr,Orange,TX,ORANGE,0.0,nonprofit,NA,NA,NA,,
OSINT,NA,COMMUNITY CHURCH ASSEMBLY OF GOD,3400 Martin Luther King Jr Dr,ORANGE,TX,ORANGE,0.0,nonprofit,NA,NA,NA,,
