Case_ID,Date,Category,Subcategory,Entity_Name,Individual_Name,Role_Title,License_Type,Incident_Description,Legal_Basis_Statute,Jurisdiction,Reporting_Deadline,Penalties_For_Noncompliance,Source_Reference,Source_URL,Status,Outcome,Notes,Linked_Case_IDs
CASE-059,2024-10-01,International,Fentanyl Precursor Export,Hanhong Pharmaceutical Technology,Wuhan-based company,Manufacturer,None,Exported large quantities of fentanyl precursors and xylazine to Sinaloa Cartel and US traffickers,21 U.S.C. § 959 / § 960,Federal / International,N/A,Up to life imprisonment,DOJ indictment,https://www.justice.gov,Confirmed,Pending,Wuhan connection,CASE-060
CASE-060,2024-10-01,International,US-China Fentanyl Conflict,China / United States,Unknown,Government,None,US alleges China insufficiently regulates fentanyl precursor exports; Chinese firms knowingly sell to cartels,Diplomatic / International Law,International,N/A,Sanctions / Tariffs,The Print / Heritage Foundation,https://www.theprint.in,Confirmed,Pending,Connects to Hanhong indictment,CASE-059
CASE-061,2024-01-01,Healthcare,Adderall Fraud Risk,Headway / Unknown,Dr. Ann Verma,Psychiatrist / Whistleblower,MD,California,Risk of drug dealers paying people to use identities and insurance to stockpile Adderall via telehealth,21 U.S.C. § 843 / False Claims Act,Federal,N/A,Up to 10 years imprisonment,Headway FAQ / Justice.gov,https://www.headway.co,Documented,Pending,Ann raised concerns about this,"CASE-014,CASE-015,CASE-016,CASE-017,CASE-018"
CASE-062,2025-08-01,Criminal,Homeless Task Force Drug Arrests,HBPD Homeless Task Force,Kristy Conway,Case Manager,None,Task Force regularly arrests homeless individuals for narcotics possession during operations,California Health & Safety Code § 11350,State,N/A,Up to 3 years imprisonment,HBPD website,https://www.hbpd.org,Confirmed,Pending,Kristy Conway involved in enforcement,"CASE-001,CASE-022,CASE-023"
CASE-063,2025-08-01,Criminal,Methamphetamine Seizure,HBPD Homeless Task Force,Unknown,Unknown,None,Suspects found with drug paraphernalia and suspected methamphetamine; one concealed large quantity,California Health & Safety Code § 11378,State,N/A,Up to 5 years imprisonment,HBPD website,https://www.hbpd.org,Confirmed,Pending,Part of HBPD enforcement pattern,CASE-062
CASE-064,2026-07-01,Silent War,Targeted Cities,Huntington Beach / Newport Beach / Irvine / Various,Unknown,Unknown,None,Multiple cities targeted across cyber, drug, environmental, and surveillance vectors,N/A,Nationwide,N/A,N/A,Katana scan results (June 2026),N/A,Confirmed,Active,Nationwide pattern,"CASE-009,CASE-010,CASE-011,CASE-035"
CASE-065,2026-07-01,Silent War,Surveillance Infrastructure,NSA / 33 Thomas Street (NYC),Unknown,Unknown,None,Windowless NSA surveillance site; high-security datacenter,NSA / FISA,Federal,N/A,N/A,Public reporting,Dailymail.co.uk,Confirmed,Active,Windowless area,"CASE-046,CASE-047"
CASE-066,2026-07-01,Silent War,Military-Corporate Nexus,L3Harris / DoD,Unknown,Defense Contractor,None,VAMPIRE counter-drone systems contracted by DoD; $106M Army contract,10 U.S.C. § 2304,Federal,N/A,N/A,DoD contract records,Defense.gov,Confirmed,Active,Defense contractor connection,"CASE-044,CASE-045"
CASE-067,2026-07-01,Silent War,Psychological Operations,Intelligence Community,Ann Verma,Whistleblower,MD,California,Memory suppression, remote viewing, and compartmentalization programs potentially used against whistleblowers,Classified,Federal,N/A,N/A,Open source intelligence / Podcasts,Multiple,Unconfirmed,Pending,Potential connection to Ann's missing timeline,"CASE-048,CASE-049"
CASE-068,2026-07-01,Silent War,Black Sites,Plum Island / Hawaiian Islands / Various,Unknown,Unknown,None,DHS security contracts for island installations; Plum Island biosecurity; Hawaiian vaults,48 U.S.C. / DHS,Federal,N/A,N/A,DHS acquisition records,DHS.gov,Confirmed,Active,Islands connection,"CASE-050,CASE-051"
CASE-069,2026-07-01,Silent War,Counter-Surveillance,Unknown,Unknown,Unknown,None,Flash photography used as counter-surveillance technique; trauma-induced amnesia documented,None,N/A,N/A,N/A,Open source intelligence,N/A,Documented,Pending,Countermeasure,CASE-052
